{
  "taskId": "task-2026-10-10-001",
  "verifierId": "verifier.image-ssim",
  "verifierRevision": "r2",
  "status": "PASS",
  "checks": [
    { "checkId": "count-conservation", "status": "PASS" },
    { "checkId": "decode-all", "status": "PASS" },
    { "checkId": "edge-bound", "status": "PASS" },
    { "checkId": "capture-date-preserved", "status": "PASS" },
    { "checkId": "ssim-oracle", "status": "PASS", "detail": "min SSIM 0.987 over 12 samples" }
  ],
  "oracleInputs": {
    "metric": "SSIM",
    "threshold": 0.95,
    "sampleStrategy": "ASC_SHA256_FIRST_20",
    "committedBeforeExecution": true
  },
  "evidenceRefs": ["evidence://task-2026-10-10-001/out/manifest.json"]
}
